{
  "schema_version": "1.0.0",
  "id": "memory-candidate-answer-fact-001",
  "project_id": "project-alpha",
  "target_layer": "atom",
  "candidate_type": "answer_fact",
  "status": "pending_review",
  "proposed_content": "项目问答必须先使用当前项目 Skill 和可追溯证据。",
  "source_refs": [
    {
      "source_id": "source-alpha",
      "locator": "char:0-20"
    }
  ],
  "provenance": {
    "model_result_id": "model-result-alpha",
    "model_request_id": "model-request-alpha",
    "recall_result_id": "recall-result-alpha",
    "document_id": "document-alpha",
    "document_revision": 1,
    "input_refs": [
      {
        "kind": "recall_result",
        "object_id": "recall-result-alpha",
        "uri": "crp://default/recall-results/recall-result-alpha.json"
      },
      {
        "kind": "model_request",
        "object_id": "model-request-alpha",
        "uri": "crp://default/model-requests/model-request-alpha.json"
      },
      {
        "kind": "model_result",
        "object_id": "model-result-alpha",
        "uri": "crp://default/model-results/model-result-alpha.json"
      },
      {
        "kind": "document",
        "object_id": "document-alpha",
        "uri": "crp://default/documents/document-alpha.json"
      }
    ]
  },
  "review": {
    "requires_user_confirmation": true,
    "auto_promote_allowed": false,
    "reason": "模型回答只能进入待审候选，不能自动写入长期记忆。",
    "reviewed_by": null,
    "reviewed_at": null
  },
  "created_at": "2026-06-30T16:00:00+08:00",
  "updated_at": "2026-06-30T16:00:00+08:00"
}
